{
  "case_id": "c2a-v0.1-tad-059-tool-exception-not-result-001",
  "comparison_mode": "contains_normative",
  "schema_results": [
    {
      "document_id": "primary",
      "schema_target": "urn:c2atrace:schema:v0.1:receipt#/$defs/ReceiptPresentation",
      "status": "valid"
    }
  ],
  "required_findings": [
    {
      "requirement_id": "TAD-059",
      "check_id": "tool-exception-not-result-001",
      "subject_selector": {
        "receipt_id": "receipt-tool-result-exception-001",
        "object_id": "diag-tad-rex-001"
      },
      "domain": "claim",
      "status": "asserted",
      "prohibited_inferences": [
        "P1:runtime_exception_automatically_becomes_tool_result"
      ]
    }
  ],
  "forbidden_findings": [],
  "process_outcome": "completed"
}
