{
  "case_id": "c2a-v0.1-pad-054-provider-retry-new-attempt-001",
  "comparison_mode": "contains_normative",
  "schema_results": [
    {
      "document_id": "primary",
      "schema_target": "urn:c2atrace:schema:v0.1:receipt#/$defs/ReceiptPresentation",
      "status": "valid"
    }
  ],
  "required_findings": [
    {
      "requirement_id": "PAD-054",
      "check_id": "provider-retry-new-attempt-001",
      "subject_selector": {
        "receipt_id": "receipt-retry-001",
        "object_id": "att-r2"
      },
      "domain": "conformance",
      "status": "valid"
    }
  ],
  "forbidden_findings": [],
  "process_outcome": "completed"
}
