{
  "case_id": "c2a-v0.1-tool-027-tool-decision-basis-unknown-001",
  "comparison_mode": "contains_normative",
  "schema_results": [
    {
      "document_id": "primary",
      "schema_target": "urn:c2atrace:schema:v0.1:receipt#/$defs/ReceiptPresentation",
      "status": "valid"
    }
  ],
  "required_findings": [
    {
      "requirement_id": "TOOL-027",
      "check_id": "tool-decision-basis-unknown-001",
      "subject_selector": {
        "receipt_id": "receipt-tool-effect-001",
        "object_id": "decision-unknown-001"
      },
      "domain": "conformance",
      "status": "valid"
    }
  ],
  "forbidden_findings": [],
  "process_outcome": "completed"
}
