{
  "case_id": "c2a-v0.1-out-047-model-structured-validation-bounded-001",
  "comparison_mode": "contains_normative",
  "schema_results": [
    {
      "document_id": "primary",
      "schema_target": "urn:c2atrace:schema:v0.1:receipt#/$defs/ReceiptPresentation",
      "status": "valid"
    }
  ],
  "required_findings": [
    {
      "requirement_id": "OUT-047",
      "check_id": "model-structured-validation-bounded-001",
      "subject_selector": {
        "receipt_id": "receipt-retry-001",
        "object_id": "structured-001"
      },
      "domain": "conformance",
      "status": "valid",
      "prohibited_inferences": [
        "P1:structured_schema_validation_upgrades_external_truth_or_semantics"
      ]
    }
  ],
  "forbidden_findings": [],
  "process_outcome": "completed"
}
