{
  "case_id": "c2a-v0.1-pad-058-provider-failover-positive-001",
  "comparison_mode": "contains_normative",
  "schema_results": [
    {
      "document_id": "primary",
      "schema_target": "urn:c2atrace:schema:v0.1:receipt#/$defs/ReceiptPresentation",
      "status": "valid"
    }
  ],
  "required_findings": [
    {
      "requirement_id": "PAD-058",
      "check_id": "provider-failover-positive-001",
      "subject_selector": {
        "receipt_id": "receipt-source-request-001",
        "object_id": "att-b-001"
      },
      "domain": "conformance",
      "status": "valid",
      "prohibited_inferences": [
        "P1:different_provider_or_model_implies_failover"
      ]
    }
  ],
  "forbidden_findings": [],
  "process_outcome": "completed"
}
