{
  "case_id": "c2a-v0.1-drv-021-derivation-unknown-region-blocks-exact-001",
  "comparison_mode": "contains_normative",
  "schema_results": [
    {
      "document_id": "primary",
      "schema_target": "urn:c2atrace:schema:v0.1:receipt#/$defs/ReceiptPresentation",
      "status": "valid"
    }
  ],
  "required_findings": [
    {
      "requirement_id": "DRV-021",
      "check_id": "derivation-unknown-region-blocks-exact-001",
      "subject_selector": {
        "receipt_id": "receipt-source-request-001",
        "object_id": "drv-001"
      },
      "domain": "completeness",
      "status": "unverified",
      "reason_code": "unknown_origin_region_blocks_exact_coverage"
    }
  ],
  "forbidden_findings": [],
  "process_outcome": "invalidity_detected"
}
