{
  "case_id": "c2a-v0.1-vfy-033-verifier-dependency-vs-time-001",
  "comparison_mode": "contains_normative",
  "schema_results": [
    {
      "document_id": "primary",
      "schema_target": "urn:c2atrace:schema:v0.1:receipt#/$defs/ReceiptPresentation",
      "status": "valid"
    }
  ],
  "required_findings": [
    {
      "requirement_id": "VFY-033",
      "check_id": "verifier-dependency-vs-time-001",
      "subject_selector": {
        "receipt_id": "receipt-retry-001",
        "object_id": "att-r2"
      },
      "domain": "conformance",
      "status": "valid",
      "prohibited_inferences": [
        "P1:verifier_prefers_timestamp_over_dependency"
      ]
    }
  ],
  "forbidden_findings": [],
  "process_outcome": "completed"
}
