{
  "case_id": "c2a-v0.1-out-022-model-hidden-routing-unknown-001",
  "comparison_mode": "contains_normative",
  "schema_results": [
    {
      "document_id": "primary",
      "schema_target": "urn:c2atrace:schema:v0.1:receipt#/$defs/ReceiptPresentation",
      "status": "valid"
    }
  ],
  "required_findings": [
    {
      "requirement_id": "OUT-022",
      "check_id": "model-hidden-routing-unknown-001",
      "subject_selector": {
        "receipt_id": "receipt-retry-001",
        "object_id": "out-r2"
      },
      "domain": "claim",
      "status": "unknown",
      "prohibited_inferences": [
        "P1:application_visible_model_metadata_reveals_hidden_routing"
      ]
    }
  ],
  "forbidden_findings": [],
  "process_outcome": "completed"
}
