{
  "case_id": "c2a-v0.1-req-034-request-digest-compatibility-001",
  "comparison_mode": "contains_normative",
  "schema_results": [
    {
      "document_id": "primary",
      "schema_target": "urn:c2atrace:schema:v0.1:receipt#/$defs/ReceiptPresentation",
      "status": "valid"
    }
  ],
  "required_findings": [
    {
      "requirement_id": "REQ-034",
      "check_id": "request-digest-compatibility-001",
      "subject_selector": {
        "receipt_id": "receipt-source-request-001",
        "object_id": "snap-digest-other-001"
      },
      "domain": "comparison",
      "status": "unverified",
      "reason_code": "request_digest_bases_incompatible"
    }
  ],
  "forbidden_findings": [],
  "process_outcome": "completed"
}
