{
  "case_id": "c2a-v0.1-pad-092-provider-metadata-normalization-basis-001",
  "comparison_mode": "contains_normative",
  "schema_results": [
    {
      "document_id": "primary",
      "schema_target": "urn:c2atrace:schema:v0.1:receipt#/$defs/ReceiptPresentation",
      "status": "valid"
    }
  ],
  "required_findings": [
    {
      "requirement_id": "PAD-092",
      "check_id": "provider-metadata-normalization-basis-001",
      "subject_selector": {
        "receipt_id": "receipt-retry-001",
        "object_id": "att-r2"
      },
      "domain": "claim",
      "status": "unknown",
      "prohibited_inferences": [
        "P1:adapter_derived_normalized_metadata_presented_as_raw_provider_evidence"
      ]
    }
  ],
  "forbidden_findings": [],
  "process_outcome": "completed"
}
