{
  "case_id": "c2a-v0.1-vfy-107-verifier-finding-private-evidence-001",
  "comparison_mode": "contains_normative",
  "schema_results": [
    {
      "document_id": "report",
      "schema_target": "urn:c2atrace:schema:v0.1:verifier#/$defs/VerificationReport",
      "status": "valid"
    }
  ],
  "required_findings": [
    {
      "requirement_id": "VFY-107",
      "check_id": "verifier-finding-private-evidence-001",
      "subject_selector": {
        "report_id": "report-vfy-process-completed-001"
      },
      "domain": "conformance",
      "status": "valid",
      "prohibited_inferences": [
        "P1:raw_private_evidence_must_be_echoed_in_report"
      ],
      "reason_code": "private_evidence_reference_suffices"
    }
  ],
  "forbidden_findings": [],
  "process_outcome": "completed"
}
