{
  "case_id": "c2a-v0.1-tad-100-tool-bypass-no-fabrication-001",
  "comparison_mode": "contains_normative",
  "schema_results": [
    {
      "document_id": "primary",
      "schema_target": "urn:c2atrace:schema:v0.1:receipt#/$defs/ReceiptPresentation",
      "status": "valid"
    }
  ],
  "required_findings": [
    {
      "requirement_id": "TAD-100",
      "check_id": "tool-bypass-no-fabrication-001",
      "subject_selector": {
        "receipt_id": "receipt-tool-bypass-001",
        "object_id": "diag-tad-bypass-001"
      },
      "domain": "claim",
      "status": "asserted",
      "prohibited_inferences": [
        "P1:bypass_evidence_fabricates_unobserved_tool_provenance"
      ]
    }
  ],
  "forbidden_findings": [],
  "process_outcome": "completed"
}
