{
  "case_id": "c2a-v0.1-priv-057-privacy-tool-arg-verification-downgrade-001",
  "comparison_mode": "contains_normative",
  "schema_results": [
    {
      "document_id": "primary",
      "schema_target": "urn:c2atrace:schema:v0.1:receipt#/$defs/ReceiptPresentation",
      "status": "valid"
    }
  ],
  "required_findings": [
    {
      "requirement_id": "PRIV-057",
      "check_id": "privacy-tool-arg-verification-downgrade-001",
      "subject_selector": {
        "receipt_id": "receipt-privacy-001",
        "object_id": "invoke-secret-001"
      },
      "domain": "support",
      "status": "unverified",
      "reason_code": "tool_argument_representation_unavailable"
    }
  ],
  "forbidden_findings": [],
  "process_outcome": "completed"
}
