{
  "case_id": "c2a-v0.1-tool-043-tool-effect-result-basis-bounded-001",
  "comparison_mode": "contains_normative",
  "schema_results": [
    {
      "document_id": "primary",
      "schema_target": "urn:c2atrace:schema:v0.1:receipt#/$defs/ReceiptPresentation",
      "status": "valid"
    }
  ],
  "required_findings": [
    {
      "requirement_id": "TOOL-043",
      "check_id": "tool-effect-result-basis-bounded-001",
      "subject_selector": {
        "receipt_id": "receipt-tool-effect-001",
        "object_id": "effect-001"
      },
      "domain": "claim",
      "status": "asserted",
      "prohibited_inferences": [
        "P1:execution_result_basis_is_independent_external_verification"
      ]
    }
  ],
  "forbidden_findings": [],
  "process_outcome": "completed"
}
