{
  "case_id": "c2a-v0.1-vfy-019-verifier-cross-receipt-object-identity-001",
  "comparison_mode": "contains_normative",
  "schema_results": [
    {
      "document_id": "primary",
      "schema_target": "urn:c2atrace:schema:v0.1:receipt#/$defs/ReceiptPresentation",
      "status": "valid"
    }
  ],
  "required_findings": [
    {
      "requirement_id": "VFY-019",
      "check_id": "verifier-cross-receipt-object-identity-001",
      "subject_selector": {
        "receipt_id": "receipt-source-request-001",
        "object_id": "frag-001"
      },
      "domain": "conflict",
      "status": "conflict",
      "reason_code": "repeated_object_identity_conflict"
    }
  ],
  "forbidden_findings": [],
  "process_outcome": "invalidity_detected"
}
