{
  "case_id": "c2a-v0.1-tad-032-tool-argument-mixed-positive-001",
  "comparison_mode": "contains_normative",
  "schema_results": [
    {
      "document_id": "primary",
      "schema_target": "urn:c2atrace:schema:v0.1:receipt#/$defs/ReceiptPresentation",
      "status": "valid"
    }
  ],
  "required_findings": [
    {
      "requirement_id": "TAD-032",
      "check_id": "tool-argument-mixed-positive-001",
      "subject_selector": {
        "receipt_id": "receipt-tool-argument-provenance-001",
        "object_id": "invoke-tad-arg-001",
        "path": "/mixed_note"
      },
      "domain": "conformance",
      "status": "valid"
    }
  ],
  "forbidden_findings": [],
  "process_outcome": "completed"
}
